{
  "schema_version": "lean-run-manifest-v0.1",
  "subject_id": "mko-euclid-pythagorean-theorem",
  "producer_version": "4.30.0",
  "mathlib_version": "v4.30.0",
  "toolchain": "Lean 4.30.0",
  "command": "cd formal/lean && lake update && lake exe cache get && lake build",
  "theorem_name": "OCMEFormal.pythagorean_vector",
  "status": "passed",
  "claim_scope": {
    "quantification": "formal_universal",
    "universal_proof": true,
    "statement_zh": "在任意實內積空間中，若向量 x 與 y 的夾角為 π/2，則向量和的範數平方等於兩向量範數平方之和。"
  },
  "checks": [
    { "id": "lake_build", "status": "passed" },
    { "id": "no_proof_placeholders", "status": "passed" },
    { "id": "theorem_OCMEFormal_pythagorean_vector", "status": "passed" }
  ],
  "limitations": [
    "此證據證明向量核心定理；邊長角色的明示綁定由獨立的 pythagorean_side_lengths 證據承擔。",
    "本證據依賴 Lean 4.30.0 核心、Mathlib v4.30.0 與指定匯入模組。",
    "形式證明不取代中文敘述、符號角色與幾何模型的人工審查。"
  ],
  "source_paths": [
    "formal/lean/lean-toolchain",
    "formal/lean/lakefile.toml",
    "formal/lean/OCMEFormal/Pythagorean.lean"
  ],
  "replay": {
    "command": "cd formal/lean && lake update && lake exe cache get && lake build",
    "expected_exit_code": 0,
    "source_artifact": "formal/lean/OCMEFormal/Pythagorean.lean"
  }
}
